{
  "schema_version": "oda.dataset_card.v0.1.0",
  "dataset_id": "dataset.fdata_fugaku",
  "generated_at": "2026-08-27T12:58:50.439335+00:00",
  "source": {
    "table_path": "data/datasets/fdata_fugaku/data.parquet",
    "system": "Fugaku",
    "descriptor": "dataset.fdata_fugaku"
  },
  "characterization": {
    "n_rows": 5793789,
    "full_span": {
      "start": "2023-02-28",
      "end": "2023-09-30"
    },
    "healthy_span": {
      "start": "2023-03-01",
      "end": "2023-09-30",
      "days": 214,
      "rows": 5793568
    },
    "daily_volume": {
      "median": 20222.0,
      "min": 2583,
      "max": 113432,
      "gap_floor": 1011.1
    },
    "rate_per_day": 27072.7,
    "gaps": [],
    "columns": {
      "user": {
        "cardinality": 1161,
        "missingness": 0.0
      },
      "job_state": {
        "cardinality": 2,
        "missingness": 0.0
      }
    },
    "runtime_seconds": {
      "min": 1.0,
      "median": 1680.0,
      "p90": 31002.2,
      "p99": 141545.5,
      "max": 259201.0
    }
  },
  "benchmark_window": {
    "rule": {
      "anchor": 0.8,
      "train_days": 60,
      "test_days": 90,
      "history_days": 120
    },
    "window_start": "2023-04-30",
    "window_end": "2023-09-26",
    "test_start": "2023-06-29",
    "test_end": "2023-09-26",
    "n_rows": 4351251,
    "rate_per_day": 29008.3,
    "gaps_in_window": [],
    "healthy": true,
    "rationale": "window END at 80% of healthy span; clear of all missing blocks."
  },
  "decisions": [],
  "provenance": {
    "schema_versions": {
      "input": "oda.job.v0.2.0",
      "result": "oda.dataset_card.v0.1.0"
    },
    "environment": {
      "python": "3.12.2",
      "packages": []
    },
    "code": {
      "package_version": "0.1.0",
      "git_commit": "fdf037fe018c5ad7eed76829bbf790b72aa73995",
      "source_hash": null
    },
    "inputs": [
      {
        "path": "data/datasets/fdata_fugaku/data.parquet",
        "sha256": "1592976399098dc801f743413857617dbf7b0c70127e6f5ec924b521f02f7718",
        "size_bytes": 142972847,
        "mtime_epoch": 1787411048.7850702
      }
    ]
  }
}
