{
  "schema_version": "oda.dataset_card.v0.1.0",
  "dataset_id": "dataset.fresco_conte",
  "generated_at": "2026-08-27T12:58:53.671794+00:00",
  "source": {
    "table_path": "data/datasets/fresco_conte/data.parquet",
    "system": "Conte",
    "descriptor": "dataset.fresco_conte"
  },
  "characterization": {
    "n_rows": 1042125,
    "full_span": {
      "start": "2015-02-08",
      "end": "2016-02-29"
    },
    "healthy_span": {
      "start": "2015-02-28",
      "end": "2016-02-29",
      "days": 367,
      "rows": 1041686
    },
    "daily_volume": {
      "median": 2172.0,
      "min": 696,
      "max": 10657,
      "gap_floor": 108.6
    },
    "rate_per_day": 2838.4,
    "gaps": [],
    "columns": {
      "queue": {
        "cardinality": 83,
        "missingness": 2e-06
      },
      "user": {
        "cardinality": 431,
        "missingness": 0.0
      },
      "account": {
        "cardinality": 30,
        "missingness": 0.0
      },
      "job_state": {
        "cardinality": 93,
        "missingness": 0.0
      }
    },
    "runtime_seconds": {
      "min": 0.0,
      "median": 568.0,
      "p90": 13375.0,
      "p99": 169229.6,
      "max": 2160054.0
    }
  },
  "benchmark_window": {
    "rule": {
      "anchor": 0.8,
      "train_days": 60,
      "test_days": 90,
      "history_days": 120
    },
    "window_start": "2015-07-22",
    "window_end": "2015-12-18",
    "test_start": "2015-09-20",
    "test_end": "2015-12-18",
    "n_rows": 318392,
    "rate_per_day": 2122.6,
    "gaps_in_window": [],
    "healthy": true,
    "rationale": "window END at 80% of healthy span; clear of all missing blocks."
  },
  "decisions": [],
  "provenance": {
    "schema_versions": {
      "input": "oda.job.v0.2.0",
      "result": "oda.dataset_card.v0.1.0"
    },
    "environment": {
      "python": "3.12.2",
      "packages": []
    },
    "code": {
      "package_version": "0.1.0",
      "git_commit": "fdf037fe018c5ad7eed76829bbf790b72aa73995",
      "source_hash": null
    },
    "inputs": [
      {
        "path": "data/datasets/fresco_conte/data.parquet",
        "sha256": "2baf86cc9bf124625676eb65e766465af6e2232204465bd450fe156556ebe3b5",
        "size_bytes": 29321219,
        "mtime_epoch": 1784400430.0889697
      }
    ]
  }
}
